시군명,명소명,주소,유형,용도,데이터기준일자,정제도로명주소,정제지번주소,정제우편번호,정제WGS84위도,정제WGS84경도
파주시,파주출판단지_살림 출판사,경기도 파주시 교하읍 문발리 522-2,공간환경,공장,2021-02-19,경기도 파주시 광인사길 22,경기도 파주시 교하읍 문발리 522-2,10881,37.7087190817,126.6851308860
파주시,파주출판단지_아시아출판문화정보센터,경기도 파주시 교하읍 문발리 524-3,공간환경,교육연구 시설,2021-02-19,,경기도 파주시 교하읍 문발리 524-3,10881,37.7076374295,126.6864246794
파주시,파주출판단지_범우사 사옥,경기도 파주시 교하읍 문발리 525-2,공간환경,공장,2021-02-19,경기도 파주시 광인사길 9-13,경기도 파주시 교하읍 문발리 525-2,10881,37.7076944011,126.6842345307
파주시,파주출판단지_근린상가블록 4-1,경기도 파주시 교하읍 문발리 531-1,공간환경,제2종 근린생활 시설,2021-02-19,경기도 파주시 문발로 142,경기도 파주시 교하읍 문발리 531-1,10881,37.7071868859,126.6864409494
파주시,파주출판단지_돌베개 사옥,경기도 파주시 교하읍 문발리 532-4,공간환경,업무시설,2021-02-19,경기도 파주시 회동길 77-20,경기도 파주시 교하읍 문발리 532-4,10881,37.7072560751,126.6873250740
파주시,파주 헤이리_카메라타 황인용스튜디오,경기도 파주시 탄현면 법흥리 1652-129,공간환경,제2종 근린생활 시설,2021-02-19,경기도 파주시 탄현면 헤이리마을길 83,경기도 파주시 탄현면 법흥리 1652-129,10859,37.7900350124,126.6996164213
파주시,파주 헤이리_헤이리 E-52 주택,경기도 파주시 탄현면 법흥리 1652-157,공간환경,단독주택,2021-02-19,경기도 파주시 탄현면 헤이리마을길 59-45,경기도 파주시 탄현면 법흥리 1652-157,10859,37.7893397894,126.6954671942
파주시,파주 헤이리_서울액션스쿨 마샬아트센터,경기도 파주시 탄현면 법흥리 1652-303,공간환경,교육연구 시설,2021-02-19,경기도 파주시 탄현면 헤이리마을길 18-61,경기도 파주시 탄현면 법흥리 1652-303,10859,37.7873794583,126.6948070362
파주시,파주 헤이리_자하재(紫霞齋),경기도 파주시 탄현면 법흥리 1652-308,공간환경,단독주택,2021-02-19,경기도 파주시 탄현면 헤이리마을길 18-49,경기도 파주시 탄현면 법흥리 1652-308,10859,37.7871040325,126.6953892232
파주시,파주 헤이리_헤이리 유리작업실,경기도 파주시 탄현면 법흥리 1652-356,공간환경,제1종 근린생활 시설,2021-02-19,경기도 파주시 탄현면 헤이리마을길 38-71,경기도 파주시 탄현면 법흥리 1652-356,10859,37.7864462630,126.6967364497
파주시,파주 헤이리_헤이리 주택,경기도 파주시 탄현면 법흥리 1652-394,공간환경,단독주택,2021-02-19,경기도 파주시 탄현면 헤이리마을길 38-43,경기도 파주시 탄현면 법흥리 1652-394,10859,37.7858239088,126.6979924164
파주시,파주 헤이리_헤이리 씨어터,경기도 파주시 탄현면 법흥리 1652-509,공간환경,문화 및 집회시설,2021-02-19,경기도 파주시 탄현면 헤이리마을길 82-138,경기도 파주시 탄현면 법흥리 1652-509,10859,37.7882725107,126.7028721822
파주시,파주 헤이리_정한숙기념관,경기도 파주시 탄현면 법흥리 1652-572,공간환경,제2종 근린생활 시설,2021-02-19,경기도 파주시 탄현면 헤이리마을길 96-20,경기도 파주시 탄현면 법흥리 1652-572,10859,37.7909130656,126.7001748203
포천시,포천 아트밸리,경기도 포천시 신북면 기지리 282,공간환경,공원,2021-02-19,경기도 포천시 신북면 아트밸리로 234,경기도 포천시 신북면 기지리 282,11139,37.9234463151,127.2364959881
화성시,미야찌 코리아(주) 사옥,경기도 화성시 능동 1060,건축물,공장,2021-02-19,경기도 화성시 동탄하나1길 28,경기도 화성시 능동 1060,18423,37.2171244275,127.0618932710
화성시,폴라리온스퀘어,경기도 화성시 반월동 717-4,건축물,업무시설,2021-02-19,,경기도 화성시 반월동 717-4,18385,37.2216372146,127.0513957740
고양시,일산호수공원,경기도 고양시 일산동구 장항동 906,공간환경,공원,2021-02-19,,경기도 고양시 일산동구 장항동 906,10400,37.6549538763,126.7687601052
고양시,올림픽플랜테이션 팜샵,경기도 고양시 덕양구 신원동 311,건축물,제2종 근린생활 시설,2021-02-19,경기도 고양시 덕양구 통일로493번안길 103-20,경기도 고양시 덕양구 신원동 311,10284,37.6824546097,126.8842131665
고양시,교보생명 일산사옥,경기도 고양시 일산구 장항동 893,건축물,업무시설,2021-02-19,경기도 고양시 일산동구 중앙로 1181,경기도 고양시 일산구 장항동 893,10414,37.6522471344,126.7770848282
고양시,민마루2 - 205스튜디오,경기도 고양시 일산동구 풍동 452-21,건축물,단독주택,2021-02-19,경기도 고양시 일산동구 고일로 207-14,경기도 고양시 일산동구 풍동 452-21,10300,37.6559539480,126.8014118545
광주시,리안주택,경기도 광주시 오포읍 신현리 634-15,건축물,단독주택,2021-02-19,경기도 광주시 오포읍 머루숯길81번길 31,경기도 광주시 오포읍 신현리 634-15,12820,37.3661987896,127.1551689114
남양주시,수백당,경기도 남양주시 화도읍 금남리 20-3,건축물,제2종 근린생활 시설,2021-02-19,경기도 남양주시 화도읍 경춘로2414번길 96,경기도 남양주시 화도읍 금남리 20-3,12193,37.6601209986,127.3602397221
부천시,한국만화영상산업진흥원,경기도 부천시 원미구 상동 529-2,건축물,문화 및 집회시설,2021-02-19,,경기도 부천시 원미구 상동 529-2,14505,37.5131520747,126.7452297663
부천시,부천시 궁도장,경기도 부천시 원미구 춘의동 48-3,건축물,운동시설,2021-02-19,,경기도 부천시 원미구 춘의동 48-3,,37.5004545562,126.7979653559
성남시,이우학교,경기도 성남시 분당구 동원동 산13-1,건축물,교육연구 시설,2021-02-19,,경기도 성남시 분당구 동원동 산13-1,,,
성남시,지노하우스,경기도 성남시 분당구 백현동 577-6,건축물,단독주택,2021-02-19,경기도 성남시 분당구 판교역로18번길 6,경기도 성남시 분당구 백현동 577-6,13536,37.3841613706,127.1109644990
성남시,a-house,경기도 성남시 분당구 분당동 51-7,건축물,단독주택,2021-02-19,경기도 성남시 분당구 예원로6번길 17,경기도 성남시 분당구 분당동 51-7,13582,37.3698489042,127.1340101062
성남시,한국파스퇴르 연구소,경기도 성남시 분당구 삼평동 696,건축물,교육연구 시설,2021-02-19,경기도 성남시 분당구 대왕판교로712번길 16,경기도 성남시 분당구 삼평동 696,13488,37.4068236771,127.1033332544
성남시,코리아디자인센터,경기도 성남시 분당구 야탑동 344-1,건축물,교육연구 시설,2021-02-19,경기도 성남시 분당구 양현로 322,경기도 성남시 분당구 야탑동 344-1,13496,37.4131083295,127.1232565127
성남시,여천제,경기도 성남시 분당구 운중동 998-4,건축물,단독주택,2021-02-19,경기도 성남시 분당구 산운로170번길 12,경기도 성남시 분당구 운중동 998-4,13460,37.3921873696,127.0804206116
성남시,율동공원,경기도 성남시 분당구 율동 318,공간환경,공원,2021-02-19,경기도 성남시 분당구 문정로 145,경기도 성남시 분당구 율동 318,13576,37.3833549433,127.1500072167
성남시,모란민속5일장,경기도 성남시 중원구 성남동 4747,공간환경,시장,2021-02-19,,경기도 성남시 중원구 성남동 4747,,37.4291356612,127.1272969677
수원시,에이블아트센터,경기도 수원시 권선구 금곡동 1021,건축물,건축물군,2021-02-19,경기도 수원시 권선구 서수원로617번길 9,경기도 수원시 권선구 금곡동 1021,16392,37.2795294703,126.9537937512
수원시,수원박물관,경기도 수원시 영통구 이의동 1088-10,건축물,문화 및 집회시설,2021-02-19,경기도 수원시 영통구 창룡대로 265,경기도 수원시 영통구 이의동 1088-10,16227,37.2976452252,127.0356337197
시흥시,시흥 능곡 보호각,경기도 시흥시 능곡동 산15,건축물,문화 및 집회시설,2021-02-19,,경기도 시흥시 능곡동 산15,14999,,
안산시,안산 외국인주민센터,경기도 안산시 단원구 원곡동 991-1,건축물,노유자 시설,2021-02-19,경기도 안산시 단원구 부부로 43,경기도 안산시 단원구 원곡동 991-1,15377,37.3324025635,126.7903429366
안성시,중앙대학교 안성캠퍼스 도서관,경기도 안성시 대덕면 내리 72-1,건축물,교육연구 시설,2021-02-19,경기도 안성시 대덕면 서동대로 4726,경기도 안성시 대덕면 내리 72-1,17546,37.0050772116,127.2247169869
안양시,관악성당,경기도 안양시 만안구 안양동 18-114,건축물,종교시설,2021-02-19,경기도 안양시 만안구 경수대로1140번길 24,경기도 안양시 만안구 안양동 18-114,13914,37.4145858203,126.9202917312
안양시,성결대학교 학술정보관,경기도 안양시 만안구 안양동 400-10,건축물,교육연구 시설,2021-02-19,경기도 안양시 만안구 성결대학로 53,경기도 안양시 만안구 안양동 400-10,14097,37.3798614510,126.9288159681
양주시,아름솔 유치원,경기도 양주시 장흥면 교현리 180-11,건축물,노유자 시설,2021-02-19,경기도 양주시 장흥면 북한산로1011번길 137,경기도 양주시 장흥면 교현리 180-11,11523,37.7079657182,126.9663205956
연천군,전곡선사박물관,경기도 연천군 전곡읍 전곡리 176-1,건축물,문화 및 집회시설,2021-02-19,경기도 연천군 전곡읍 평화로443번길 2,경기도 연천군 전곡읍 전곡리 176-1,11027,38.0115925690,127.0637687656
파주시,파주출판단지_웅진씽크빅 사옥,경기도 파주시 교하읍 문발리 535-1,공간환경,공장,2021-02-19,경기도 파주시 회동길 20,경기도 파주시 교하읍 문발리 535-1,10881,37.7045354294,126.6849044317
파주시,파주출판단지_교문사,경기도 파주시 교하읍 문발리 536-2,공간환경,공장,2021-02-19,경기도 파주시 문발로 116,경기도 파주시 교하읍 문발리 536-2,10881,37.7050580555,126.6874965510
파주시,파주출판단지_7321디자인,경기도 파주시 교하읍 문발리 592-1,공간환경,공장,2021-02-19,경기도 파주시 유채꽃길 30,경기도 파주시 교하읍 문발리 592-1,10884,37.7205983223,126.7049255182
파주시,파주 헤이리_딸기가 좋아,경기도 파주시 탄현면 법흥리 1652,공간환경,제1종 근린생활 시설,2021-02-19,,경기도 파주시 탄현면 법흥리 1652,10859,37.7922982375,126.6957872005
파주시,파주 헤이리_이씨의 북카페와 집,경기도 파주시 탄현면 법흥리 1652,공간환경,단독주택,2021-02-19,,경기도 파주시 탄현면 법흥리 1652,10859,37.7922982375,126.6957872005
파주시,파주 헤이리_헤이리,경기도 파주시 탄현면 법흥리 1652,공간환경,마을,2021-02-19,,경기도 파주시 탄현면 법흥리 1652,10859,37.7922982375,126.6957872005
파주시,파주 헤이리_헤이리논밭예술학교,경기도 파주시 탄현면 법흥리 1652-118,공간환경,제2종 근린생활 시설,2021-02-19,경기도 파주시 탄현면 헤이리마을길 93-45,경기도 파주시 탄현면 법흥리 1652-118,10859,37.7901987238,126.6971841914
파주시,파주 헤이리_백순실 미술관,경기도 파주시 탄현면 법흥리 1652-140,공간환경,제1종 근린생활 시설,2021-02-19,경기도 파주시 탄현면 헤이리마을길 59-30,경기도 파주시 탄현면 법흥리 1652-140,10859,37.7892755950,126.6966263211
파주시,파주 헤이리_랜드마크하우스,경기도 파주시 탄현면 법흥리 1652-208,공간환경,제2종 근린생활 시설,2021-02-19,경기도 파주시 탄현면 헤이리마을길 63,경기도 파주시 탄현면 법흥리 1652-208,10859,37.7891170456,126.6984906090
파주시,파주 헤이리_루프하우스,경기도 파주시 탄현면 법흥리 1652-308,공간환경,단독주택,2021-02-19,경기도 파주시 탄현면 헤이리마을길 18-49,경기도 파주시 탄현면 법흥리 1652-308,10859,37.7871040325,126.6953892232
파주시,파주 헤이리_헤이리더스텝바람동,경기도 파주시 탄현면 법흥리 1652-34,공간환경,판매시설,2021-02-19,경기도 파주시 탄현면 헤이리마을길 93-75,경기도 파주시 탄현면 법흥리 1652-34,10859,37.7914360764,126.6962394881
파주시,파주 헤이리_헤이리 어린이전문서점,경기도 파주시 탄현면 법흥리 1652-394,공간환경,제1종 근린생활 시설,2021-02-19,경기도 파주시 탄현면 헤이리마을길 38-43,경기도 파주시 탄현면 법흥리 1652-394,10859,37.7858239088,126.6979924164
파주시,파주 헤이리_MOA + 시경당,경기도 파주시 탄현면 법흥리 1652-469,공간환경,공동주택,2021-02-19,,경기도 파주시 탄현면 법흥리 1652-469,10859,37.7876958133,126.7002322133
파주시,파주 헤이리_갤러리 소소,경기도 파주시 탄현면 법흥리 1652-569,공간환경,제2종 근린생활 시설,2021-02-19,경기도 파주시 탄현면 헤이리마을길 92,경기도 파주시 탄현면 법흥리 1652-569,10859,37.7908117707,126.6998579050
파주시,파주 헤이리_터치아트갤러리,경기도 파주시 탄현면 법흥리 1652-569,공간환경,제2종 근린생활 시설,2021-02-19,경기도 파주시 탄현면 헤이리마을길 92,경기도 파주시 탄현면 법흥리 1652-569,10859,37.7908117707,126.6998579050
평택시,해군2함대 안보전시관(서해수호관),경기도 평택시 포승읍 원정리 1298,건축물,문화 및 집회시설,2021-02-19,,경기도 평택시 포승읍 원정리 1298,17950,36.9959318567,126.8143913857
포천시,포천반월아트홀,경기도 포천시 군내면 하성북리 596-6,건축물,문화 및 집회시설,2021-02-19,,경기도 포천시 군내면 하성북리 596-6,11151,,
포천시,포천시립 일동도서관,경기도 포천시 일동면 기산리 284-3,건축물,교육연구 시설,2021-02-19,경기도 포천시 일동면 화동로 1021,경기도 포천시 일동면 기산리 284-3,11120,37.9549078724,127.3155515678
화성시,나래울(화성시 복합복지타운),경기도 화성시 능동 1130,건축물,노유자 시설,2021-02-19,경기도 화성시 여울로2길 33,경기도 화성시 능동 1130,18427,37.2051692503,127.0515721500
화성시,동우밸브콘트롤 공장,경기도 화성시 장안면 수촌리 120,건축물,공장,2021-02-19,경기도 화성시 장안면 용당골길 3,경기도 화성시 장안면 수촌리 120,18581,37.0882392843,126.8611267641
고양시,허유재병원,경기도 고양시 일산구 장항동 780,건축물,의료시설,2021-02-19,경기도 고양시 일산동구 중앙로 1317,경기도 고양시 일산구 장항동 780,10401,37.6629288877,126.7699403885
고양시,임거당,경기도 고양시 일산구 장항동 803-6,건축물,단독주택,2021-02-19,,경기도 고양시 일산구 장항동 803-6,,,
고양시,일산ㄱ자집,경기도 고양시 일산동 1325-2,건축물,단독주택,2021-02-19,,경기도 고양시 일산동 1325-2,,,
고양시,고양아람누리,경기도 고양시 일산동 구마두동 816,건축물,문화 및 집회시설,2021-02-19,경기도 고양시 일산동구 중앙로 1286,경기도 고양시 일산동 구마두동 816,10409,37.6619067057,126.7751884537
과천시,Kwater 수도권 광역 상수도 통합운영센터,경기도 과천시 갈현동 649-1,건축물,업무시설,2021-02-19,경기도 과천시 교육원로 11,경기도 과천시 갈현동 649-1,13841,37.4228841586,126.9881391196
과천시,국립현대미술관,경기도 과천시 막계동 산58-4,건축물,문화 및 집회시설,2021-02-19,경기도 과천시 광명로 313,경기도 과천시 막계동 산58-4,13829,37.4309778122,127.0199705127
과천시,과천시 청소년수련관,경기도 과천시 문원동 199,건축물,수련시설,2021-02-19,경기도 과천시 참마을로 9,경기도 과천시 문원동 199,13828,37.4264279877,127.0008873763
과천시,코오롱타워,경기도 과천시 별양동 1-23,건축물,업무시설,2021-02-19,경기도 과천시 코오롱로 11,경기도 과천시 별양동 1-23,13837,37.4255545396,126.9905290931
광명시,광명 스피돔,경기도 광명시 광명동 452,건축물,문화 및 집회시설,2021-02-19,,경기도 광명시 광명동 452,14283,,
광명시,KTX 광명역,경기도 광명시 일직동 267-2,건축물,운수시설,2021-02-19,,경기도 광명시 일직동 267-2,,,
광주시,영은미술관,경기도 광주시 쌍령동 8-1,건축물,문화 및 집회시설,2021-02-19,경기도 광주시 청석로 300,경기도 광주시 쌍령동 8-1,12791,37.4135545420,127.2687473164
광주시,오르는 집,경기도 광주시 오포읍 신현리 506-4,건축물,단독주택,2021-02-19,경기도 광주시 오포읍 새말길329번길 30-18,경기도 광주시 오포읍 신현리 506-4,12820,37.3848821010,127.1766815466
광주시,중앙대학교자연장 관리동,경기도 광주시 중대동 46-3,건축물,제1종 근린생활 시설,2021-02-19,경기도 광주시 순암로 192,경기도 광주시 중대동 46-3,12768,37.3990004224,127.2278810502
남양주시,북한강 철교 자전거길,경기도 남양주시 조안면 진중리,공간환경,가로(거리),2021-02-19,,경기도 남양주시 조안면 진중리,12281,,
부천시,서울신학대학교 우석기념관,경기도 부천시 소사구 소사본2동 101,건축물,교육연구 시설,2021-02-19,경기도 부천시 호현로489번나길 12,경기도 부천시 소사구 소사본2동 101,14755,37.4802532737,126.7918763635
부천시,가톨릭대학교 김수환추기경국제관 및 성심컨벤션센터,경기도 부천시 원미구 역곡2동 산43-1,건축물,교육연구 시설,2021-02-19,,경기도 부천시 원미구 역곡2동 산43-1,14662,37.4844850683,126.8032378356
부천시,가톨릭대학교성심교정 학생회관,경기도 부천시 원미구 역곡동 산43-1,건축물,교육연구 시설,2021-02-19,,경기도 부천시 원미구 역곡동 산43-1,14662,37.4844850683,126.8032378356
성남시,가나안교회,경기도 성남시 분당구 구미동 207,건축물,종교시설,2021-02-19,경기도 성남시 분당구 미금로 34,경기도 성남시 분당구 구미동 207,13626,37.3367240077,127.1172262683
성남시,분당 C-11-4-12,경기도 성남시 분당구 분당동 51-5,건축물,단독주택,2021-02-19,경기도 성남시 분당구 예원로6번길 11,경기도 성남시 분당구 분당동 51-5,13582,37.3701460411,127.1339070176
성남시,SK텔레시스 판교연구소,경기도 성남시 분당구 삼평동 671,건축물,교육연구 시설,2021-02-19,경기도 성남시 분당구 판교역로 225-12,경기도 성남시 분당구 삼평동 671,13494,37.4008453455,127.1080762400
성남시,할렐루야교회,경기도 성남시 분당구 야탑동 132,건축물,종교시설,2021-02-19,경기도 성남시 분당구 야탑로 368,경기도 성남시 분당구 야탑동 132,13509,37.4104142500,127.1561302368
성남시,르 씨뜨 빌모트,경기도 성남시 분당구 운중동 379-4,건축물,공동주택,2021-02-19,경기도 성남시 분당구 하오개로351번길 9,경기도 성남시 분당구 운중동 379-4,13455,37.3921398708,127.0574989126
성남시,새마을운동중앙연수원 구)새마을지도자 연수원,경기도 성남시 분당구 율동 200,건축물,교육연구 시설,2021-02-19,경기도 성남시 분당구 새마을로 257,경기도 성남시 분당구 율동 200,13575,37.3901789525,127.1563469512
성남시,금토동 주택,경기도 성남시 수정구 금토동 107-2,건축물,단독주택,2021-02-19,경기도 성남시 수정구 달래내로221번길 28,경기도 성남시 수정구 금토동 107-2,13450,37.4175245539,127.0777591806
수원시,수원시휴먼서비스센터 구)권선동사무소,경기도 수원시 권선구 권선동 1165,건축물,제1종 근린생활 시설,2021-02-19,경기도 수원시 권선구 권선로 754,경기도 수원시 권선구 권선동 1165,16562,37.2571731961,127.0334690017
수원시,아주대학교 에너지센터,경기도 수원시 영통구 원천동 산5,건축물,교육연구 시설,2021-02-19,,경기도 수원시 영통구 원천동 산5,,37.2833457572,127.0464761597
수원시,경기대학교 텔레컨벤션센터,경기도 수원시 영통구 이의동 산94-6,건축물,교육연구 시설,2021-02-19,경기도 수원시 영통구 광교산로 154-42,경기도 수원시 영통구 이의동 산94-6,16227,37.2980139010,127.0331153297
수원시,수원시 연화장,경기도 수원시 영통구 하동 25,건축물,묘지관련 시설,2021-02-19,,경기도 수원시 영통구 하동 25,16511,37.2903986504,127.0845751288
안산시,선부동 마을만들기,경기도 안산시 단원구 선부동,공간환경,마을,2021-02-19,,경기도 안산시 단원구 선부동,,,
안산시,안산 상록구 사할린 고향마을 용하운동장,경기도 안산시 상록구 사동 1535-2,공간환경,공원,2021-02-19,,경기도 안산시 상록구 사동 1535-2,15501,37.3048135679,126.8547369586
안성시,우리은행 안성연수원,경기도 안성시 공도읍 마정리 339-1621,건축물,교육연구 시설,2021-02-19,,경기도 안성시 공도읍 마정리 339-1621,17548,,
안성시,안성맞춤박물관,경기도 안성시 대덕면 내리 산57,건축물,문화 및 집회시설,2021-02-19,,경기도 안성시 대덕면 내리 산57,17546,37.0111659479,127.2291854889
안양시,관양동 J&J빌딩,경기도 안양시 동안구 관양동 1433-22,건축물,단독주택,2021-02-19,경기도 안양시 동안구 관악대로 399,경기도 안양시 동안구 관양동 1433-22,13939,37.4050172940,126.9671209284
안양시,금강펜테리움 IT타워,경기도 안양시 동안구 관양동 810,건축물,업무시설,2021-02-19,경기도 안양시 동안구 학의로 282,경기도 안양시 동안구 관양동 810,14056,37.4009700962,126.9691155194
안양시,안양시립비산도서관,경기도 안양시 동안구 비산동 459-56,건축물,교육연구 시설,2021-02-19,경기도 안양시 동안구 관악대로 123,경기도 안양시 동안구 비산동 459-56,13922,37.3991120357,126.9376519309
안양시,대림대학 홍지관,경기도 안양시 동안구 비산동 526-7,건축물,교육연구 시설,2021-02-19,경기도 안양시 동안구 임곡로 29,경기도 안양시 동안구 비산동 526-7,13916,37.4032880854,126.9306832691
안양시,G.Square 롯데백화점 평촌점,경기도 안양시 동안구 호계동 1039,건축물,판매시설,2021-02-19,경기도 안양시 동안구 시민대로 180,경기도 안양시 동안구 호계동 1039,14073,37.3899508706,126.9503840690
안양시,중앙성당,경기도 안양시 만안구 안양동 627-75,건축물,종교시설,2021-02-19,경기도 안양시 만안구 장내로 116,경기도 안양시 만안구 안양동 627-75,13997,37.3961015450,126.9208634411
안양시,안양예술공원,경기도 안양시 만안구 안양동 산21,공간환경,공원,2021-02-19,,경기도 안양시 만안구 안양동 산21,,,
양평군,복지교회 리노베이션,경기도 양평군 용문면 신점리 575-1,건축물,종교시설,2021-02-19,경기도 양평군 용문면 도매기길 76,경기도 양평군 용문면 신점리 575-1,12510,37.5428752497,127.5794208861
여주시,알로에 마임비전빌리지,경기도 여주군 능서면 용은리 443,공간환경,교육연구 시설,2021-02-19,,경기도 여주군 능서면 용은리 443,12640,37.2924710640,127.5397531038
오산시,물향기수목원_산림전시관,경기도 오산시 수청동 332-4,공간환경,문화 및 집회시설,2021-02-19,경기도 오산시 청학로 211,경기도 오산시 수청동 332-4,18118,37.1662479454,127.0543477507
오산시,오산스포츠센터,경기도 오산시 오산동 49,건축물,운동시설,2021-02-19,경기도 오산시 경기동로 15,경기도 오산시 오산동 49,18131,37.1568594226,127.0726136232
용인시,한국민속촌,경기도 용인시 기흥구 보라동 107,공간환경,관광휴게 시설,2021-02-19,,경기도 용인시 기흥구 보라동 107,17075,,
용인시,지앤 아트 스페이스,경기도 용인시 기흥구 상갈동 150-7,건축물,문화 및 집회시설,2021-02-19,경기도 용인시 기흥구 백남준로 7,경기도 용인시 기흥구 상갈동 150-7,17068,37.2699167734,127.1101319262
용인시,백남준아트센터,경기도 용인시 기흥구 상갈동 85,건축물,문화 및 집회시설,2021-02-19,,경기도 용인시 기흥구 상갈동 85,17073,37.2677369554,127.1084627384
용인시,용인 솔마당집,경기도 용인시 역북동 377-6,건축물,단독주택,2021-02-19,경기도 용인시 처인구 금학로241번길 13,경기도 용인시 역북동 377-6,17046,37.2393717885,127.1906754953
용인시,타운하우스 ‘웰가’,경기도 용인시 처인구 원삼면 문촌리 440-30,건축물,제1종 근린생활 시설,2021-02-19,경기도 용인시 처인구 원삼면 문촌로219번길 70-36,경기도 용인시 처인구 원삼면 문촌리 440-30,17169,37.1644110357,127.2844774106
의왕시,의왕시 중앙도서관(책마루),경기도 의왕시 고천동 160-3,건축물,교육연구 시설,2021-02-19,,경기도 의왕시 고천동 160-3,16075,37.3419515532,126.9695571857
의왕시,계원예술학교,경기도 의왕시 내손동 산125,건축물,교육연구 시설,2021-02-19,,경기도 의왕시 내손동 산125,,,
